{
  "id": 384,
  "name": "Rayquaza",
  "types": [
    "dragon",
    "flying"
  ],
  "stats": [
    {
      "name": "HP",
      "value": 105,
      "max": 255
    },
    {
      "name": "Attack",
      "value": 150,
      "max": 255
    },
    {
      "name": "Defense",
      "value": 90,
      "max": 255
    },
    {
      "name": "Sp. Atk",
      "value": 150,
      "max": 255
    },
    {
      "name": "Sp. Def",
      "value": 90,
      "max": 255
    },
    {
      "name": "Speed",
      "value": 95,
      "max": 255
    }
  ],
  "sprite": "https://raw.githubusercontent.com/PokeAPI/sprites/master/sprites/pokemon/other/official-artwork/384.png",
  "height": 70,
  "weight": 2065,
  "description": "It flies endlessly through the ozone layer, consuming meteoroids. The precious minerals in meteoroids fuel its internal mega-reactors.",
  "divineTier": "Ozone Sentinel",
  "ability": "Air Lock",
  "nature": "Jolly",
  "originLore": "Rayquaza patrols the ozone shell, devouring meteoroids that would fracture the planet's atmospheric shield. Mineral fuel from those impacts feeds its mega-reactors.",
  "lore": {
    "originEpoch": "Ozone Vigil Cycle",
    "celestialConcordance": "As long as Rayquaza coils through the upper sky, sky and earth remain sealed against stellar debris.",
    "aethericFrequency": "670.2 Hz",
    "resonanceRating": "88.0%",
    "divineTier": "Ozone Sentinel",
    "quantumResonators": [
      {
        "name": "Dragon Ascent",
        "description": "Converts altitude and velocity into a singular piercing vector."
      },
      {
        "name": "Delta Stream",
        "description": "Nullifies weather lattices across the theater of engagement."
      }
    ]
  }
}
