{
  "id": 7997,
  "name": "Astral-Ho-Oh (The Eternal Prismatic Sovereign)",
  "types": [
    "fire",
    "flying",
    "astral"
  ],
  "stats": [
    {
      "name": "HP",
      "value": 106,
      "max": 255
    },
    {
      "name": "Attack",
      "value": 130,
      "max": 255
    },
    {
      "name": "Defense",
      "value": 90,
      "max": 255
    },
    {
      "name": "Sp. Atk",
      "value": 154,
      "max": 255
    },
    {
      "name": "Sp. Def",
      "value": 154,
      "max": 255
    },
    {
      "name": "Speed",
      "value": 90,
      "max": 255
    }
  ],
  "sprite": "assets/pokemon/Prismatic-Sovereign-Ho-Oh.png",
  "height": 38,
  "weight": 199.0,
  "description": "A high-tier synthesis of Ho-Oh and Necrozma. Known as the Prismatic Phoenix, it governs the spectrum of life and light, its wings refracting divine energy into eternal rainbows that cleanse the entropic void.",
  "divineTier": "Solar Sovereign",
  "ability": "Regenerator / Prism Armor (Astral)",
  "nature": "Brave",
  "originLore": "Born from the intersection of a solar eclipse and the sacred flame. Astral-Ho-Oh was forged when Necrozma's light-refracting shards fused with the legendary phoenix's eternal plumage, creating a guardian that eternally restores the balance of light across the Aetherium.",
  "lore": {
    "originEpoch": "Solar Resonance Epoch",
    "celestialConcordance": "Astral-Ho-Oh serves as the ultimate beacon of hope, turning the shadows of the void into harmonic light signals that fuel the birth of new stars.",
    "aethericFrequency": "924.7 YJ",
    "resonanceRating": "HIGH",
    "divineTier": "Solar Sovereign",
    "quantumResonators": [
      {
        "name": "Sacred Fire (Astral)",
        "description": "Unleashes a torrent of prismatic flames that burn away dimensional corruption while restoring the life force of allies."
      },
      {
        "name": "Prismatic Rebirth",
        "description": "Channels the light of a thousand suns to rewrite a fractured moment, essentially resetting the local entropy to a state of pure creation."
      }
    ]
  }
}